District,SS,Toponym,Chrononym,Def,Context,Year,Comment,Latitude,Longitude,DISS
Вохом,Обуховский,Выставка,СВЯТКи,святки,"В СвяткИ бЕгали закрывАли: прЯжи к колОдцу настАвят, потОм смОтрят чегО у когО с прЯжей стАнет, кАк-то разбирАли, цЕлая пАртия бЕгала.",2012 лето,,,,
Вохом,Тихоновский,Заречье,СВЯТКи,Святки,Илию-то пИли когда? Вот в СвяткИ-то и пИли! Специальные были частушки.,2011 авг.,,,,
Вохом,Маручатский,Погорелка,СВЯТКи,Святки,"Все СвяткИ бегали, подшучивали.",2011 авг.,,,,
Вохом,Согорский,Согра,СВЯТКи,Святки,"Четырнадцатого января бывают СвяткИ: колдуют, бывает.",2012 лето,,,,
Вохом,Тихоновский,Питер,СВяТКИ,период времени от Рождества до Крещения,"В СвЯтки гуляли по вечерам, играли, плясали. Пустят к кому, заходишь ‒ сегодня ко мне, завтра к тебе. Под окошком бегали, подслушивали да на дорогах гадали, на крестАх.",2011 авг.,,,,
Вохом,Согорский,Согра,СВЯТКи,Святки,"КулешмЕнить ‒ это вот что: в СвяткИ боле кулешмЕнят. Ну одеваются что-нибудь такое ‒ в чертиков, в кого-нибудь, да ходят. Бывает, по квартирам. Или в окно стучат: заглянешь, а там ‒ кулешмЕнец.",2012 лето,,,,
Вохом,Петрецовский,Кекур,СВЯТКи,праздничные дни между Рождеством и Крещением,"ХодИли, ходИли, пугАли, Это СвяткАми бЫло. ГадАли на СвяткИ.",2012 лето,,,,
Вохом,Согорский,Согра,СВЯТКи,святки,"КулешмЕнцы вОде они кулешмЕнят ходят как раз в эти дни в январе-то, а там уже потом время придёт, ве нельзя ходить, там период. Это в это время, в эти СвяткИ.",2012 лето,,,,
Нерех,Федоровский,Гилево,СВЯТоЙ ПАХоМИЙ,28 мая,"На Святого Пахомия на гору поднимались. Сколько можешь, идёшь",2019 лето,,,,
Шар,Троицкий,Руданиха,СВЯТоЙ ТиХОН,"день св. Тихона, 29 июня","ТИхонов день, святой ТИхон был 29 июня, с него уже начинали косить. Все престольные праздники праздновали три дня.",2012 лето,ТиХОНОВ ДеНЬ,,,
Пав,Павинский,Фурово,СВЯТыЕ ВЕЧЕРа,7-14 января,"В святЫе вечерА только гадали, а в страшнЫе и гадали, и колдовали.",2009 авг.,,,,
Окт,Соловецкий,Первая Клобуковская,СВЯТыЕ ВЕЧЕРа,период с Рождества до Старого Нового года (13 января),"С НОвого-то гОду поЮт: ""СвятЫе вечерА, васИльевские"", а потОм уж ‒ страшнЫе вечерА.",2011 авг.,,,,
Пав,Леденгский,Леденгск,СВЯТыЕ ВЕЧЕРа,святки (период времени от Нового года до Крещения?),"СтрашнЫе вечерА да Крещенские. Это вот с Нового года да с Рождества, а потом уж 19-го Крещенье было... СтрашнЫе-те вечерА перед Крещением. СтрашнЫе вечерА да васИльевские вечерА. СвятЫе вечерА ‒ это уже крещенское, уже последние. А сначала страшные, хОдят страшнЫе вечерА. ВасИльевские – то же самое.",2009 авг.,Ср. СТРАШНыЕ ВЕЧЕРа.,,,
Кологр,Илешевский,Зеленино,СДВиЖЕНИЕ,27 сентября,На СдвИжение всё змеиные свадьбы шли. Вроде как все ползучие сдвигаются.,2024 лето,,,,
Ост,Хомутовский,Ливенка,СДВиЖЕНЬЕ,"праздник Воздвижение Креста Господня, отмечаемый 27 сентября в б. д. Ливенка",,2022 лето,,,,
Окт,Покровский,Филино,СДВиЖЕНЬЕ,"Воздвижение, 14/27 сентября",Жни ‒ СдвИженья не жди.,2011 февраль,,,,
Буй,Дьяконовский,Шумовица,СДВиЖЕНЬЕ,престольный праздник 27 сентября у д. Шумовица Дьяконовского с/с,"За рекой праздник был, СдвИженье, рядом деревня Шумовица, так это 27 сентября.",2018 лето,,,,
К-С,Шолоховский,Сажино,СДВиЖЕНЬЕ,"Воздвижение Креста Господня, 27 сентября","На Сдвиженье все гадюки уползают, уходят в землю.",2019 лето,,,,
Пав,Павинский,Шараниха,СДВиЖЕНЬЕ,праздник 27 сентября,"СдвИженьё, БогорОдица, БогорОдицын День.",2009 авг.,,,,
Кологр,Илешевский,Варзенга,СДВиЖЕНЬЁ,"Воздвижение Креста Господня, праздник, отмечаемый 27 сентября",После СдвИженья все змеи убираться должны.,2024 лето,,,,
Пав,Леденгский,Леденгск,СЕДМиЦА,о Троице,ВознесЕньев день на 5-й неделе после Паски. Троица Пресвятая. А Троица ‒ седмИца.,2009 авг.,,,,
Меж,Петушихский,Горка,СЕДМиЦА,семь недель от Пасхи до Троицы,,2023 лето,,,,
Кологр,Черменинский,Черменино,СеДЬМИ оТРОКИ,"праздник в д. Морхинино Черменинского с/с, 17.08",СЕдьми Отроки отмечали у нас в Морхинино.,2024 лето,< б. д. Морхинино,,,
Кологр,Черменинский,Марьино,СеДЬМИ оТРОКИ,праздник (какой?),"Слышала о празднике СЕдьми Отроки, но не знаю, где это было.",2024 лето,,,,
Буй,Боровский,Борок,СЕМеИН ДеНЬ,1 сентября,"СемЕин дЕнь 1 сентября. Мухи и так переводиться будут, а всё равно в коробок ‒ и закапывали. Чтобы мух не было, а и так уж переведутся.",2018 лето,,,,
Буй,Дьяконовский,Юрецкие,СЕМеИН ДеНЬ,"праздник, отмечаемый 14 сентября","В СемЕин день мух хоронЯют, полОжат в корОбочку и закопАют где.",2003 июль,,,,
Парф,Матвеевский,Матвеево,СЕМеИН ДеНЬ,"праздник, отмечаемый 15-го сентября и сопровождающийся обычаем хоронить мух",Пятнадцатого сентября ‒ СемЕин день ‒ СемЁн-именИнник ‒ и пятнадцатого сентября хоронили мух.,2006 авг.,,,,
Парф,Ширский,Николо-Ширь,СЕМеИН ДеНЬ,"праздник, отмечаемый в с. Николо-Ширь в сентябре","В СемЕин День мух хоронИли в спИчечных коробкАх, чтОбы их не было.",2006 авг.,,,,
Буй,Дьяконовский,Натальино,СЕМеИН ДеНЬ,праздник 14 сентября в д. Натальино,"СемЕин день 14 сентября, ревЕли о мухах: ""НОнче мух нЕту"". А что мУхи не накусАют, не разбУдят.",2003 июль,,,,
Шар,Нюрюгский,Нюрюг,СЕМеЙНЫЙ ДеНЬ,Праздник 7 сентября,"С СемЕйной ДнИ вроде муха-то это, в СемЕйный ДЕнь муху-то хороняли. Ой, говорит, повезём слепня в ошемётке хоронять, а муху-то ‒ в СемЕйной ДЕнь. А СемЕйной ДЕнь ‒ числа седьмого сентября. В СемЕйной ДЕнь муху хороняли.",2013 лето,"< Костр. обл., Шарьин. р-н, Катунин. с/с, с. Печенкино",,,
Вохом,Маручатский,Погорелка,СЕМёН,церковный праздник 14 сентября,"СемЁнов день бывает 14-го сентября. В СемЁнов день до обеда лён слали, а после не слали ‒ бабье лето с СемЁна начиналося.",2011 авг.,СЕМёНОВ ДеНЬ,,,
Пав,Леденгский,Леденгск,СЕМёН ДеНЬ,церковный праздник 14 сентября,"Комары, мухи сейчас до СемЁна дня живут. СемЁнов день будет 14-го. Они уже погибнут все. Там мУха мУху, говорят, хоронЯет ‒ сама пропадает, приговаривают. А ежели останутся они, ещё зиму проживут эти мухи. Они убирАются, они, видно, во дворах, а и в домах есть, которые убирАются.",2009 авг.,СЕМёНОВ ДеНЬ,,,
Пав,Медведицкий,Медведица,СЕМёНОВ,"Семёнов день, 14 сентября","Августовские росы самые хорошие, надо до них вЫтеребить, до СемЁнова управиться.",2009 авг.,,,,
Окт,Сивцевский,Останино,СЕМеНОВ ДеНЬ,1 сентября,В СемЁнов дЕнь мух хоронЯют: в коробОк накладУт и закопАют в землЕ. С СемЁнова дня наступАет бАбье лЕто.,2011 февраль,,,,
Окт,Сивцевский,Останино,СЕМёНОВ ДеНЬ,1 сентября,В СемЁнов дЕнь если нерЯха вЫйдёт на Улицу ‒ погОда всю Осень плохАя бУдёт. Если нормАльная ‒ хорОшая.,2011 февраль,,,,
Окт,Соловецкий,Грехово,СЕМёНОВ ДеНЬ,14 сентября,До СемЁнова дня уж нАдо всё вЫжать.,2011 авг.,,,,
Пав,Леденгский,Леденгск,СЕМёНОВ ДеНЬ,церковный праздник 14 сентября,"Комары, мухи сейчас до СемЁна дня живут. СемЁнов день будет 14-го. Они уже погибнут все. Там мУха мУху, говорят, хоронЯет ‒ сама пропадает, приговаривают. А ежели останутся они, ещё зиму проживут эти мухи. Они убирАются, они, видно, во дворах, а и в домах есть, которые убирАются.",2009 авг.,СЕМёН ДеНЬ,,,
Окт,Власовский,Веденьё,СЕМёНОВ ДеНЬ,14 сентября,Перед СемЁновым днём мУхи кусАться бУдут. СкОро СемЁнов день ‒ нАдо мух хоронИть. Хоть в зЕмлю закопАть их.,2011 авг.,,,,
Вохом,Вохомский,Вохма,СЕМёНОВ ДеНЬ,"праздник, 1 сентября","Осенью были СемЁнов день, ФролОв день праздник был.",2011 февраль,,,,
Пав,Леденгский,Леденгск,СЕМёНОВ ДеНЬ,церковный праздник 14-го сентября,"А не знаю, какие осЁнные праздники. СемЁнов день, бУдё, 14-го сентября.",2009 авг.,,,,
Кадый,Столпинский,Столпино,СЕМёНОВ ДеНЬ,"праздник, отмечаемый в сентябре",В этот день мрут мухи. В коробок положат дети-то и закопают.,2004 авг.,МуХОВ ДеНЬ,,,
Окт,Стариковский,Ильинское,СЕМёНОВ ДеНЬ,"праздник, отмечаемый 14 сенября",ЧетЫрнадцатого сентябрЯ СемЁнов день. В СемЁнов день ужЕ закАнчивается Уборка с пОля.,2011 авг.,,,,
Вохом,Воробьевицкий,Воробьёвица,СЕМёНОВ ДеНЬ,"праздник (11 сентября), в который считали, что нельзя ходить в лес, потому что охотятся волки","В СемЁнов День, 11 сентября, не ходи никогда в лес, волки бызУют, парами с подругами охотятся.",2011 авг.,,,,
Парф,Аносовский,Аносово,СЕМёНОВ ДеНЬ,престольный праздник в д. Аносово (14 сентября),,2006 авг.,,,,
Пав,Медведицкий,Медведица,СЕМёНОВ ДеНЬ,день св. Симеона Столпника,СемЁнов День 14 сентября был. А гулянье-то уж не знаю где было.,2009 авг.,,,,
Пав,Леденгский,Леденгск,СЕМёНОВ ДеНЬ,праздник 14 сентября,СемЁнов День бывает в сентябре.,2009 авг.,,,,
Кадый,Столпинский,Новый Курдюм,СЕМёНОВ ДеНЬ,праздник в конце августа,"На СемЁнов день мух хоронИли: брАли стЕбель у подсОлнуха, разрезАли да заклАдывали тудА.",2004 авг.,,,,
Окт,Власовский,Малая Стрелка,СЕМёНОВ ДеНЬ,14 сентября,СемЁнова дня дожидАли картОшку копАть.,2011 авг.,,,,
Окт,Власовский,Высокое,СЕМёНОВ ДеНЬ,14 сентября,"Под августОвские рОсы лён стЕлют, до СемЁнова дня.",2011 авг.,,,,
Вохом,Петрецовский,Ключи,СЕМёНОВ ДеНЬ,день 14 сентября,БАбье лЕто с СемЁнова дня начинАется.,2012 лето,,,,
Вохом,Обуховский,Масленниково,СЕМёНОВ ДеНЬ,14 сентября,"С СемЁнова дня ‒ он уже 14 сентября бывает ‒ мы бегаем, девчушки, с прЕсницами, прясть.",2012 лето,,,,
Окт,Власовский,Высокое,СЕМёНОВ ДеНЬ,14 сентября,В Семёнов день баба красивая выйдет ‒ осень будет тёплая. А выйдет зассяка ‒ будет дождливоё.,2011 авг.,,,,
Вохом,Петрецовский,Сенькино,СЕМёНОВ ДеНЬ,14 сентября по н. ст.,СемЁнов день бывает четырнадцатого сентября и семЁновская трусеЯ.,2012 лето,,,,
Вохом,Маручатский,Погорелка,СЕМёНОВ ДеНЬ,церковный праздник 14 сентября,"СемЁнов день бывает 14-го сентября. В СемЁнов день до обеда лён слали, а после не слали ‒ бабье лето с СемЁна начиналося.",2011 авг.,СЕМёН,,,
Чухл,Петровский,Большое Коровье,СЕМёНОВ ДеНЬ,"праздник, отмечаемый 13 сентября в б. дд. Починок, Большое Коровье, Озерки Петровского с/с",,2024 лето,,,,
Кологр,Понговский,Церковное,СЕМи оТРОКИ,17 августа,"В Церковном жила <деревня в сельсовете Понговский Кологривского района>, у них был праздник Семи Отроки.",2024 лето,,,,
Нерех,Татарский,Татарское,СЕМиК,праздник в четверг перед Троицей,"В семИк обычно девчонки ходили с березкой, навешают лоскутов и гуляют с ней, бабка им яичницу сделает.",2019 лето,,,,
Нерех,Татарский,Татарское,СЕМиК,праздник в четверг перед Троицей,На семИк берёзку рядили и по деревне ходили.,2019 лето,,,,
Нерех,Владычневский,Владычное,СЕМиК,"праздник, отмечающийся в мае","Семик-то женский и детский праздник. В этот день дети собирали яйца, старшие делали яичницу дома. Где росла берёзка, там её рядили. Ленточки вязали на счастье.",2019 лето,,,,
Нерех,Тетеринский,Тетеринское,СЕМиК,праздник в четверг перед Троицей,"на семИк мы с березкой ходили по деревне, наряжали ее",2019 лето,,,,
Нерех,Емсненский,Емсна,СЕМиК,четверг перед Троицей,"СемИк ‒ в четверг он перед Троицей. Все приносили яички, мама нам сделает яичницу, и вот на мостУ сидим.",2019 лето,,,,
Нерех,Емсненский,Емсна,СЕМиК,"Праздник, четверг перед Троицей","Троица праздник проходит там, на пруду, а накануне Троицы ‒ Семик, девушки завивают берёзку. Я сама ходила. Лоскутки ‒ вот такая тоненькая сАржа-то, как подкладочный материал, или ленточки простые, капроновые. На Костромской дороге тоже такие берёзки есть",2019 лето,,,,
К-С,Чапаевский,им. Чапаева,СЕМиК,четверг перед Троицей,"Семик больше девушки праздновали, живую берёзку ходили наряжать, хороводы водили. Посреди луга, огумнА своего-то у нас у одной девчонки, стояла берёзка, мы с сестрой туда ходили. Бабушка нам даст по яйцу, а большие девчонки все какой-то припАс сделают, кто морковки, кто чего. Песенки пели.",2019 лето,,,,
Нерех,Татарский,Татарское,СЕМиК,"праздник для девушек (12-13 лет), отмечаемый в четверг перед Троицей","В Семик бегали, березку наряжали ленточками, ели яичницу с молоком.",2019 лето,,,,
Нерех,Емсненский,Емсна,СЕМиК,"Праздник, который в селе Ёмсна празднуют за неделю до православного праздника Троицы","Берёзку завивали. Это в день берёзки, это в Троицу, перед Троицей ‒ Семик, за неделю до Троицы. Завивают берёзку и поют песни. Бантики завязывали. Здоровые будут, и в семье счастье будет.",2019 лето,,,,
Мак,Николо-Макаровский,Николо-Макарово,СЕМиК,седьмой четверг после Пасхи,"СемИк был, в июне месяце, и мы собирались все на реку, набирали, у кого что есть, яички с собой возьмём, и там справляли, сидели ели.",2022 лето,,,,
Шар,Конёвский,Конёво,СЕМиК,"праздник, отмечаемый весной (когда?)","У девчОнок был прАздник семИк, онИ бЕгали к берЁзкам и завЯзывали лЕнточки.",2012 лето,,,,
Нерех,Емсненский,Емсна,СЕМиК,"детский праздник, которых проходил за неделю до Троицы",Всех детей в дом собирали и устривали семИк.,2019 лето,,,,
Нерех,Григорцевский,Григорцево,СЕМиК,четверг перед Троицей,"СемИк был ‒ по деревне ходили. Троица в воскресенье, а СемИк в четверг был. Приносили молока и по два яйца и делали пастушИху. Человек десять нас было девчонок. РядИли берёзку, приносили комкИ ‒ цветные тряпки, пели песни. КумИк-семИк. Когда с берёзой по ",2019 лето,,,,
Нерех,Владычневский,Владычное,СЕМиК,"праздник для девушек (12‒13 лет), отмечаемый в четверг перед Троицей","В Семик все девки по яйцу собирали, молоко приносили, кто-нибудь из баб им яичницу готовил. На Семик еще березку завивали, срубят ее, тряпочками нарядят, а потом в пруд спустят.",2019 лето,,,,
Нерех,Хомутовский,Сараево,СЕМиК,"Праздник, четверг перед Троицей","Девчонки Семик делали, берёзку украшали. Мы не были там у них. Всё сами делали.",2019 лето,,,,
Нерех,Хомутовский,Хомутово,СЕМиК,праздник в четверг перед Троицей,"В СемИк дети собирали по два яйца, и бабка им делала яичницу, наряжали березку ленточками и ходили по деревням, песни пели.",2019 лето,,,,
Нерех,Хомутовский,Хомутово,СЕМиК,"праздник для девушек (12-13 лет), отмечаемый в четверг перед Троицей","Этот семик у нас был у девчонок, все березку рядили лентами, яичницу сделаём, а потом эту березку бросим куда-нибудь.",2019 лето,,,,
Нерех,Лавровский,Незнаново,СЕМиК,четверг перед Троицей,"Семик был детский праздник. Рано утром парни приписают берёзку, принесут девчонкам. Девчонки идут венки завивать. Венки завьют тайком, для гадания. Все собираются девчонки в одном месте, приносят по яйцу. Кто из старших (мать чья или бабка) им готовит яичницу. Ночуют тоже девчонки в этом доме. Березку нарядят, венки заплетут – и по селу идут гулять. Яичницу едят, кумятся: ""Покумимся, кума! Не ругаться, не браниться До Троицына дня"".",2019 лето,,,,
К-С,Шолоховский,Сопырево,СЕМиК,четверг перед Троицей,"Берёзку в СемИк завивали. В июне бывает, варят яишницу ‒ пастУшку ‒ в печи. Там одни женщины гуляли. Раньше они уходили в берёзки, были берёзовые рощи, там пели, гуляли. Яишницу туда уносили. В белых платках ходили.",2019 лето,,,,
Нерех,Татарский,Ушаково,СЕМиК,праздник в четверг перед Троицей,"В СемИк девочки березку наряжали и ходили с ней, собирали молоко, яйца, какая-нибудь бабка им пекла яичницу.",2019 лето,,,,
Нерех,Емсненский,Новая,СЕМиК,четверг перед Троицей,"Он считается женский праздник, СемИк. Берёзку лентами нарЕдим, и с этой берёзкой ходили по селу. А тетя Катя нам делала яишницу на молоке.",2019 лето,,,,
