District,SS,Toponym,Chrononym,Def,Context,Year,Comment,Latitude,Longitude,DISS
Вохом,Маручатский,Макарята,ЕГоРЬЕВ ДеНЬ,"праздник 6 мая: день, когда первый раз в году выпускали скот на пастбища",ЕгОрьев День шестого мая. С икОнкой выпускали. Говорили: храни скотинушку-матушку.,2011 авг.,,,,
Вохом,Малораменский,Малое Раменье,ЕГоРЬЕВ ДеНЬ,6 мая,У менЯ на ЕгОрьев день корОва сдОхла.,2012 лето,,,,
Вохом,Лапшинский,Лапшино,ЕГоРЬЕВ ДеНЬ,"праздник 6 мая, день первого выгона скота","На ЕгОрьев День лУчше для скотА и для всегО, хоть вокруг дОма вЫведёт хозЯйка.",2011 февраль,,,,
Окт,Власовский,Малая Стрелка,ЕГоРЬЕВ ДеНЬ,"праздник, отмечаемый 6 мая",Вся скотИна на ЕгОрьев День нА полё пойдЁт.,2011 авг.,,,,
Вохом,Вохомский,Вохма,ЕГоРЬЕВ ДеНЬ,праздник 6 мая,"ЕгОрьев день, он же для скота-то. В этот день выгоняли скот уже, но если трава-то ещё не вырастет, кто дома подержит. А начинали пасти с НикОлина дня. // В ВасИлий КапИльнихи если петух, говорят, напьётся, петУху много ли надо, капельку, в ЕгОрьев день баран наестся, значит трава будет.",2011 февраль,,,,
Вохом,Заветлужский,Заветлужье,ЕГоРЬЕВ ДеНЬ,"праздник 6 мая, в который принято впервые весной выгонять скот на пастбище","ТрАвка поспИёт на ЕгОрьев День, скотИнку погОнят и бласловЯт: ""Бог с тобОй, ХристОс с тобОй, идИ домОй"".",2012 лето,,,,
Вохом,Тихоновский,Малое Сокерино,ЕГоРЬЕВ ДеНЬ,6 мая день Св. Георгия,"Старухи-те сводятся в кучку, на верёвочках коров-то поводят там в ЕгОрьев ДЕнь, в НикОлин ДЕнь ли. Отпускают с того дня всё.",2011 авг.,,,,
Буй,Контеевский,Корёга,ЕГоРЬЕВ ДеНЬ,"праздник, отмечавшийся 6-го мая в пос. Корёга",ЕгОрьев дЕнь шестого мая в Корёге.,2018 лето,,,,
Нерех,Лавровский,Незнаново,ЕГоРЬЕВ ДеНЬ,6 мая,"Четверговая соль серая, обжигали в печи её. Запекали в тесто соли, давали скотине от хвори. В Егорьев день скота погонят ‒ четверговой соли давали на хлебушке.",2019 лето,,,,
Окт,Власовский,Высокое,ЕГоРЬЕВ ДеНЬ,6 мая,"Если в ЕвдокИю петух напьётся, то в ЕгОрьев день баран наестся.",2011 авг.,ЕГоРИЙ,,,
Буй,Дьяконовский,Боярское,ЕГоРЬЕВ ДеНЬ,день почитания святого Егория,В ЕгОрьев дЕнь нельзя ходить в сад. В земле не ройся.,2018 лето,,,,
Вохом,Петрецовский,Петрецово,ЕГоРЬЕВ ДеНЬ,"праздник, отмечаемый 6 мая","Скот рАньше выгонЯли в ЕгОрьев день. // Если в ЕвдокИю петУх напьётся, в ЕгОрьев день барАн наЕстся.",2012 лето,,,,
Мак,Шемятинский,Никулино,ЕГоРЬЕВ ДеНЬ,6 мая,"На Егория, на Егорьев-то день, скот надо выгонять с иконой, тогда всё хорошо будет",2021 ноябрь,ЕГоРИЙ,,,
Вохом,Петрецовский,Кекур,ЕГоРЬЕВ ДеНЬ,"праздник, отмечаемый 6 мая; день первого выгона скота","ТОлько в ЕгОрьев день пускАли корОвушок. МОжет, и снег бывАет, и всЯкоё, кто вЫпустит, кто не вЫпустит. // ОбЫчно берУт вЕрбу, в цЕркву хОдят, а то из цЕрквы берУт, принОсят. И гнАли Этой вЕрбой. Кто ничЁ не понимАет ‒ батогОм, кто свичОй, кто как. Но обЫчно со дворА вЕрбой выгонЯт. // Если дак в ЕгОрьев день кУрочка напьЁтся, то овЕчушка наЕстся ‒ Это знАчит, травА бУдёт, Если будет тЁпло, кАпать.",2012 лето,,,,
Вохом,Бельковский,Политово,ЕГоРЬЕВ ДеНЬ,6 мая,"Это 6 мая, ЕгОрьев день, вот скотинку раньше первый раз в оградку выпускали 6 мая, этой вербочкой передавали Егорию Победоносцу на всё лето, он хранит скотинку.",2011 февраль,< Политово,,,
Кадый,Столпинский,Мужичковская,ЕГоРЬЕВ ДеНЬ,праздник в д. Мужичковская (6.05.),"После ЕгОрьева дня скот выгонЯли, вЕрбу брАли, обходИли егО, бИли вЕрбой, чтоб онИ гулЯли дружнЕй, не убегАли.",2004 авг.,,,,
Вохом,Маручатский,Погорелка,ЕГоРЬЕВ ДеНЬ,"праздник, в день празднования которого скотину выгоняют из дома, держа в руках иконку","А как же! Есть праздник, когда скот весь из дому гонят ‒ ЕгОрьев День называли.",2011 авг.,,,,
Кадый,Лубянский,Лубяны,ЕГоРЬЕВ ДеНЬ,праздник в д. Лубяны (7 мая),,2004 авг.,,,,
Мак,Шемятинский,Никулино,ЕГоРЬЕВ ДеНЬ,"праздник, отмечаемый 6 мая",Егорьев день был шестого мая.,2021 ноябрь,,,,
Окт,Власовский,Заборье,ЕГоРЬЕВ ДеНЬ,"праздник, день св. Георгия-Победоносца, отмечаемый 6 мая","""В ЕгОрьев день 6 мая выпускАют корОв в огрАду, и обходИть нАдо еЁ с икОнкой НиколАя-ЧудотвОрца и БогомАтери. В мИсочки полОжишь лАданку, уголькОв горЯчих, свЕчечку и обхОдишь напрОтив сОлнца: Подь, корОвушка, во пОлюшко, Ешь трАвушку шелкОвую, Пей вОду ключевУю. СОлнышко понИже, КорОвушка поблИже. СОлнышко на закАт, ИдИ, моЯ корОвушка, домОй спать. На стАрое печИще, На стАрое местИще. Ко мне, рабЕ БОжьей АлексАндре, во вЕки векОв. АмИнь.""",2011 авг.,,,,
Окт,Власовский,Лямино,ЕГоРЬЕВ ДеНЬ,день св. Георгия-Победоносца; 6 мая н. ст.,"""В ЕгОрьев день обхОдят скотИнку с икОной Этой: БАтюшка ЕгОрий, СпасИ и сохранИ нАшу скотИнушку.""",2011 авг.,,,,
Мак,Нежитинский,Фролово,ЕГоРЬЕВ ДеНЬ,"Юрьев день, 6 мая","6 мая ЕгОрьев день, ЕгОрий с теплОм, а НикОла с копнОй.",2004 авг.,,,,
Пав,Крутогорский,Шайменский,ЕГоРЬЕВ ДеНЬ,"день св. Георгия, 5 мая (н. ст.)","В ЕгОрьев день выпускАли скотИну с вЕрбой. ВЕрба в ПАску освячЁнная. ПоглАдят вЕрбой. ПастУх обойдЁт стАдо кругОм, чтобы онИ не разбегАлись... (Пастух) вЕрбу с собОй несЁт.",2009 авг.,,,,
Пав,Крутогорский,Шайменский,ЕГоРЬЕВ ДеНЬ,"1) день св. Георгия, 6 мая (н. ст.); 2) день св. Георгия, 9 декабря (н. ст.)",,2009 авг.,,,,
Пав,Петропавловский,Петропавловское,ЕГоРЬЕВ ДеНЬ,"6 мая н. ст., календарь","В ЕгОрьев день заклинАли св. ЕгОрия. ""СымИ, ГОсподи, с моЕй скотИнки болЕзни насИльные и всЯкие сглАзы злых людЕй. АмИнь. (3 раза)"" Это говорЯт, когда выпускАют скотИну.",2009 авг.,,,,
Пав,Петропавловский,Петропавловское,ЕГоРЬЕВ ДеНЬ,"день св. Георгия, 6 мая (н. ст.)",На ЕгОрьев день скотА выпускАют.,2009 авг.,,,,
Пав,Шаймский,Шайма,ЕГоРЬЕВ ДеНЬ,"день св. Георгия Победоносца, который совпадает с первым выгоном скота (6 мая)","И коров ненадолечко, да выпустят в ЕгОрьев День. В первый день как выпускают, корову вербочкой хлешшут.",2009 авг.,,,,
Мак,Тимошинский,Холобурдиха,ЕГоРЬЕВ ДеНЬ,6 мая,"На Егорьев день с вербой корову обходят. Обойдут кругом, слова скажут. И в стадо гонят их, чтоб свыклись, а то они бодутся друг с другом-то.",2023 лето,,,,
Окт,Соловецкий,Соловецкое,ЕГоРЬЕВ ДеНЬ,6 мая,"Скот выпускАли на ЕгОрьев день, шестОго мАя. Но бОльше на НикОлин День, двАдцать вторОе мАя. // Если на ВасИлии-КапИльники петУх напьЁтся ‒ на ЕгОрьев день барАн наЕстся.",2011 авг.,,,,
Окт,Соловецкий,Соловецкое,ЕГоРЬЕВ ДеНЬ,6 мая,"В мАе ЕгОрьев День, на ЕгОрьев День рассАду садИли. // Если на ВасИлии КапИльники петУх напьЁтся ‒ на ЕгОрьев день барАн наЕстся.",2011 авг.,,,,
Окт,Луптюгский,Луптюг,ЕГоРЬЕВ ДеНЬ,6 мая,"""ЕгОрьев день для скотИнки. БАтюшко ЕгОрий, Пой-кормИ моЮ корОвушку. На пОруки берИ Да по шЁрстке гладь, Да и в пОлюшке берегИ.""",2011 авг.,,,,
Окт,Забегаевский,Забегаево,ЕГоРЬЕВ ДеНЬ,"день св. Георгия, 6 мая",В ЕгОрьев день скота выпустить надо. // На ЕгОрьев день хвосты обстригают да под матицу ложат.,2011 авг.,< б. д. Заросшие Дербы,,,
Окт,Власовский,Малая Стрелка,ЕГоРЬЕВ ДеНЬ,6 мая,"КорОв выпускАли в ЕгОрьев день. Вкруг дворА обходИли, хозЯйка с икОной ЕгОрия.",2011 авг.,,,,
Вохом,Петрецовский,Сенькино,ЕГоРЬЕВ ДеНЬ,6 мая,"ВасИльники-КапИльники бывАют, с крЫши покАплет ‒ в ЕгОрьев день петУх напьЁтся.",2012 лето,,,,
Кадый,Чернышевский,Починок,ЕГоРЬЕВ ДеНЬ,"праздник, отмечаемый 6 мая в д. Меленки",,2004 авг.,,,,
Парф,Задоринский,Макарино,ЕГоРЬЕВ ДеНЬ,праздник Святого великомученика Победоносца Георгия,"""В ЕгОрьев день люди выходили окликАть скотИну. Один из них вешал барабАнку на шею, и пастухи били палками об доску и приговаривали: БАтюшка ЕгОрий, ЕгОрий ПреподОбный, СпасИ нашу скотИнку, всю животИнку, В пОле и в лЕсе, за пОлем, за лесОчком, За все наши трудЫ, за егОрьевские: В пОле лАпти изорвАли Да в оврАги покидАли, Чтобы нАши не узнАли.""",2006 авг.,,,,
Вохом,Семёновский,Спас,ЕГоРЬЕВ ДеНЬ,"праздник, отмечаемый 6 мая","Если в ЕвдокИю петух напьётся, то в ЕгОрьев День баран наестся.",2011 авг.,,,,
Мак,Усть-Нейский,Заречье,ЕГоРЬЕВ ДеНЬ,6 мая,"На ЕгОрьев дЕнь семена освящаются, которые пойдут на посадку.",2022 лето,ГЕоРГИЙ ПОБЕДОНоСЕЦ,,,
Нерех,Татарский,Татарское,ЕГоРЬЕВ ДеНЬ,"праздник, отмечаемый 6 мая, в который нельзя было дотрагиваться до земли, работать","На Егорьев нельзя сажать ничего, скотину выгонять.",2019 лето,,,,
Мак,Юровский,Юрово,ЕГоРЬЕВ ДЕНЬ,6 мая,"""пастух обходил всё стадо в ЕгОрьев день ‒ первый день выгАнивали ‒ и читал молитву //У меня и теперь верба-то на дворе приткнЁна. Обходили с вербой коров-то. Это в Ягорьев. Чтобы сохранял их Ягорий и домой пригонял.""",2022 лето,,,,
К-С,Сидоровский,Булдачиха,ЕГоРЬЕВ ДеНЬ,"праздник, отмечаемый 5 мая","Лук сажали либо за день до Егорьева дня, либо на следующий день.",2019 лето,,,,
Вохом,Сосновский,Сосновка,ЕГоРЬЕВ ДеНЬ,6 мая,"ЕгОрьев дЕнь ‒ 6 мая, в ЕгОрьев дЕнь выпускали.",2012 лето,,,,
Мак,Юровский,Юрово,ЕГоРЬЕВ ДеНь,6 мая,"В Ягорьев день обойдёшь вокруг своёй коровы с вербой. Хлеба возьмёшь, посолишь, иконку. Делали, штёб корова паслась без убытка.",2022 лето,,,,
Вохом,Сосновский,Андрианово,ЕГоРЬЕВ ДеНЬ,6 мая,"Вообще в Николин день стараемся [выгонть скот] или в Егорьев день. Пойдут раньше с иконками [вокруг коров], иконку выносили, перекрестят с иконками: Никола-защитник, Господи, благослови мою скотинушку.",2012 лето,,,,
Вохом,Сосновский,Андрианово,ЕГоРЬЕВ ДеНЬ,6 мая,"Раньше выгоняли с ЕгОрьева днЯ, 6 мая. Говорят, надо в ЕгОрьев дЕнь скотину выпускать. Иконкой обходят её, чтобы Господь спас приговаривают: ""Егорий-батюшка, корми мою коровушку, я зимой кормила, тебе летом кормить. Днём со стадом води, а вечером домой веди"".",2012 лето,,,,
Пав,Медведицкий,Медведица,ЕГоРЬЕВ ДеНЬ,"6 мая, день Св. Георгия Победоносца; начиная с этого дня скотину выгоняли на пастбище","ЕгОрьев день, шестое мая, выгонЯли в него. Преимущество этому дню дают, что надо выгонять скот на пастбище.",2009 авг.,,,,
Шар,Зебляки,Зебляки,ЕГоРЬЕВ ДеНЬ,6 мая,"Шестого мая ЕгОрьев дЕнь, Егорий-победоносец, и вылезает вся эта Утварь [о змеях]. В ЕгОрев день и ЗвИженьё не надо в лес ходить.",2014 авг.,,,,
Мак,Николо-Макаровский,Трещеткино,ЕГоРЬЕВ ДеНЬ,"день св. Георгия Победоносца, отмчаемый 6 мая по н. ст.","В ЕгОрьев день на рекУ ходили, шестого мая. Если есть чего, дак возьмём, а нет – так побежим, любЯсь и радуЯсь.",2022 лето,,,,
Кадый,Чернышевский,Поломы,ЕГоРЬЕВ ДеНЬ,"церковный праздник, отмечаемый 6 мая в д. Меленки",,2004 авг.,,,,
Мак,Усть-Нейский,Заречье,ЕГоРЬЕВ ДеНь,6 мая,"В Егорьев день скотинку выгоняли с молитвой. Бабушка ходила, кстила коровок, овечек, вокруг обходила, соли на хребет сыпала.",2022 лето,,,,
С-Гал,Жилинский,Попово,ЕГоРЬЕВ ДеНЬ,"церковный праздник, отмечаемый 6-го мая","В ЕгОрьев день веснОй, шестОго мАя, давАли тЁлочке Этот крЕстик.",2003 июль,,,,
Окт,Луптюгский,Лебеди,ЕГоРЬЕВ ДеНЬ,день 7 мая,"КорОв на ЕгОрьев день пЕрвый раз вывОдят, Если травА есть.",2011 авг.,,,,
Окт,Покровский,Первая Ключевская,ЕГоРЬЕВ ДеНЬ,"день св. Георгия Победоносца, 6 мая","В ЕгОрьев день раньше всё выгоняли (скотину). Ну уж, бабы, сегодня ЕгОрьев день. С хлебушком выпускали.",2011 авг.,,,,
Пыщ,Носковский,Носково1,ЕГоРЬЕВ ДеНЬ,6 мая,Выгоняю коров на пастбище в ЕгОрьев день по-настоящему. 6 мая он бывает.,2015 лето,,,,
Шар,Конёвский,Подолиха,ЕГоРЬЕВ ДеНЬ,"день св. Георгия Победоносца, 6 мая",КукУшка начинАет с ЕгОрьева дня куковАть.,2012 лето,,,,
Шар,Ивановский,Гольяниха,ЕГоРЬЕВ ДеНЬ,16 ноября,"ЕгОрьев День в Гольянихе, Козионихе, Хмелёвке, Малой Слудке.",2014 авг.,,,,
Шар,Конёвский,Подолиха,ЕГоРЬЕВ ДеНЬ,"день св. Георгия Победоносца, 6 мая",КукУшка начинАет с ЕгОрьева дня куковАть.,2012 лето,,,,
Окт,Соловецкий,Первая Клобуковская,ЕГоРЬЕВ ДеНЬ,6 мая,"РАньше у нас, у БаракОв, в ЕгОрьев день всё выпускАли скотИну.",2011 авг.,ЕГоРИЙ,,,
Шар,Конёвский,Подолиха,ЕГоРЬЕВ ДеНЬ,"день св. Георгия Победоносца, 6 мая","ДомА обходИли в ЕгОрьев день. Со свечОй, бывАло.",2012 лето,,,,
Шар,Конёвский,Подолиха,ЕГоРЬЕВ ДеНЬ,"день св. Георгия Победоносца, 6 мая","В ЕгОрьев день обхОдят дом, икОну берУт, свЕчку зажигАешь. МолИтву говорЯт.",2012 лето,,,,
Шар,Конёвский,Бердиха,ЕГоРЬЕВ ДеНЬ,6 мая,Все АлексАндры в ЕгОрьев День менИнницы.,2012 лето,,,,
Пав,Павинский,Малый Завраг,ЕГоРЬЕВ ДеНЬ,"праздник (6 мая), в который происходил первый выгон скота",В ЕгОрьев день вЫпустили с бОгом (скот). СпасИ и сохранИ.,2009 авг.,,,,
Окт,Покровский,Катушенки,ЕГоРЬЕВ ДеНЬ,"день св. Георгия Победоносца, 6 мая","ЕгОрьев день шестОго мАя. На лугАх ещЁ ничегО нет, хоть на верЁвке да повОдят скотИну. ВЕрбу с ВЕрбного воскресЕнья во двор под потолОк втыкАли.",2011 февраль,< б. д. Бережок,,,
С-Слав,Залужский,Ощурки,ЕГоРЬЕВ ДеНЬ,"праздник в д.Ощурки, 6 мая","Лук сажали на Николу, 22 мая. Или капусту сеют на рассаду в Егорьев день, это 6 мая. Кукушка начинает куковать. И капусту засеваем на рассаду.",2019 лето,,,,
С-Слав,Судиславский,Болотово,ЕГоРЬЕВ ДеНЬ,"праздник, отмечаемый 6 мая","Пастуха рядИли весной, как начинается трава, обычно на ЕгОрьев дЕнь",2019 лето,,,,
С-Слав,Судиславский,Глебово,ЕГоРЬЕВ ДеНЬ,"праздник, отмечаемый в пос. Глебово 6 мая","""На ЕгОрьев ДЕнь проводили праздник сгона скотины. Хозяйки в новое, чистое оденутся. Веточки обвязывали красивыми лямочками. Присказки """"Батюшка Егорушка…"""", чтобы она пришла с удоем // пастухи ‒ они ходили по чередАм / чтобы пастухи не обижали скотину ‒ обычай сгона / 6 мая ЕгОрьев ДЕнь.""",2019 лето,,,,
Шар,Конёвский,Подолиха,ЕГоРЬЕВ ДеНЬ,"день св. Георгия Победоносца, 6 мая","В ЕгОрьев день обхОдят дом, икОну берУт, свЕчку зажигАешь. МолИтву говорЯт.",2012 лето,,,,
Пав,Петропавловский,Берёзовка,ЕГоРЬЕВ ДеНЬ,6 мая,"В ЕгОрьев день скотИну выгонЯли: ""ЕгОрий-ПобедонОсец, моЮ корОвушку поИ-кормИ, домОй водИ."" С икОнкой выпускАют.",2009 авг.,,,,
Ост,Клеванцовский,Воскресенское,ЕГоРЬЕВ ДеНЬ,"праздник, отмечаемый 6 мая","По ЕгОрьевому днЮ скотину в первый раз гнали <пастись>. Шестого мая снег растает, трава вырастет.",2023 лето,Информант родом из д. Боговарово Вохом. р-на.,,,
Пав,Доброумовский,Шубот,ЕГоРЬЕВ ДеНЬ,праздник 6 мая,"РАньше бОльше говорИли, что в ЕгОрьев день пЕрвую скотИну попускАем, бУдет теплО, бУдем гонЯть, не бУдет, помЕшкаем.",2009 авг.,,,,
Ост,Хомутовский,Борок,ЕГоРЬЕВ ДеНЬ,"праздник, отмечаемый 6 мая","В ЕгОрьев дЕнь смотрели: если трава зелёная, можно сощипнуть ‒ хоть корове, хоть овечке, начинали сгонять на первый сгон.",2022 лето,,,,
Пав,Петропавловский,Вторая Грязучая,ЕГоРЬЕВ ДеНЬ,"день св. Георгия, отмечаемый 6 мая (н. ст.)","В ЕгОрьев день корОв выгонЯли. ХвостЫ подрезАли, копЫта облажАли. ГоворИли: давАй облАдим копЫта и рогА.",2009 авг.,,,,
Парф,Николо-Поломский,Екимово,ЕГоРЬЕВ ДеНЬ,"праздник в честь св. Егория, 6 мая в д. Екимово","В ЕгОрьев День вЕчером пЯтого числА окликАют скотИнку пЕсенкой, и скотИнка гулЯть выходИла, а на трЕтий день еЁ гнАли в пОле; Это день в честь ЕгОрия ПобедонОсца ‒ полковОдец был такОй; а ещЁ все соберУтся гурьбОй и ЕгОрию на свЕчк",2006 авг.,,,,
