District,SS,Toponym,Chrononym,Def,Context,Year,Comment,Latitude,Longitude,DISS
Шар,Марутинский,Сергеево,МуХОВ ДеНЬ,праздник (когда?) с принесением в избу последнего снопа и имеющий одной из целей избавление от насекомых,"Какой-то мУхов дЕнь был, считали. Вот сноп делали ‒ серпами жали ‒ так несут его в дом: К шИру, мух, вон: Идёт хозЯин в дом. И этот сноп ставили в бОжий Угол.",2014 авг.,,,,
Вохом,Маручатский,Богатыриха,МЯСНаЯ СУББоТА,праздник перед Масляной неделей,"МяснАя суббОта, дак мясо надо исть.",2011 авг.,,,,
Вохом,Маручатский,Погорелка,МЯСНаЯ СУББоТА,"суббота накануне Масленой недели, когда поминают родителей","МяснАя суббОта перед Масленицей бывает, родителей поминали. // На МАсленицу, на МяснУю суббОту и поминали родителей.",2011 авг.,,,,
Окт,Луптюгский,Афонино,МЯСНаЯ СУББоТА,суббота перед Масленой неделей,МяснАя суббОта бывает перед Масленицей.,2011 авг.,,,,
Вохом,Малораменский,Малое Раменье,МЯСНаЯ СУББоТА,первая суббота после Великого Поста,"После ГовИнья мяснАя суббОта, когда разрешается есть мясо.",2012 лето,,,,
Окт,Покровский,Боговарово,МЯСНаЯ СУББоТА,суббота на Масляной неделе (?),"МяснАя суббОта ‒ это в МАсленую неделю, то же, как МАсленая суббОта, на неё блины пекли.",2011 февраль,,,,
Окт,Покровский,Катушенки,МЯСНаЯ СУББоТА,суббота перед Масленицей,"МяснАя суббОта, там умёрших всех поминают, до МАсленицы. Удавленники поминаются только в МяснУю суббОту, а больше нельзя поминать удавленников ‒ что-то плохое случится. // Перед МАсленицей на могилах (удавленники, утопленники) оставляют полотенце, кто удавился. А другим умЁршим другой раз, баню топят, приглашают умЁрших.",2011 февраль,< б. д. Бережок,,,
Окт,Покровский,Клюкино,МЯСНаЯ СУББоТА,суббота перед Масленицей,В МяснУю СуббОту родителей поминают. Мясного поедят.,2011 февраль,,,,
Окт,Сивцевский,Останино,МЯСНаЯ СУББоТА,суббота перед Масленицей,"МяснАя СуббОта есть, мяса много едят.",2011 февраль,,,,
Окт,Покровский,Андреево,МЯСНаЯ СУББоТА,суббота перед Масленой неделей,В послЕдний раз мясо ели перед постом.,2011 февраль,,,,
Окт,Покровский,Андреево,МЯСНаЯ СУББоТА,суббота перед Масленой неделей,"ДмИтриевская суббОта, ТрОицкая суббОта, МяснАя суббОта ‒ это всё поминальные субботы.",2011 февраль,,,,
Пав,Медведицкий,Медведица,МЯСНоЕ ЗаГОВЕНЬЕ,воскресенье перед Масленой неделей,"ЯИчное ЗАговенье весной, Яблочное ‒ 22 августа. Было МяснОе ЗАговенье ‒ Мясоед.",2009 авг.,МЯСОеД,,,
Парф,Ширский,Николо-Ширь,МЯСНоЕ ЗаГОВЕНЬЕ,последнее воскресенье перед масленицей,"Раньше, когда Масленица была, уже не разрешалось мясо, только рыбное, не яйца, ничего, а из яиц даже ничего не делали.",2006 авг.,ЯиЧНОЕ ЗаГОВЕНЬЕ,,,
Парф,Савинский,Савино,МЯСНоЕ ЗаГОВЕНЬЕ,Масленица,В МяснОе ЗАговинье венчали.,2006 авг.,,,,
Буй,Боровский,Борок,МЯСНоЕ ЗаГОВЕНЬЕ,"воскресенье перед масленичной неделей, после которого не ели мясо","Перед Масленицей воскресенье – МяснОе зАговенье, жгли маленький костёр, сожигАли мЯсо, это неделю последнюю мясо не ели. <...> МяснОе ЗАговенье за неделю до Масленицы. // Под горой свадьба венчается, а на горе свет кончается. Конец света в МяснОеЗАговенье бует. А раньше в МяснОе ЗАговенье последние свадьбы были. // МяснОе ЗАговенье - предпоследнее воскресенье перед Великим Постом. Мясо кончалось, на масленичной неделе уж мясо не ели, всё яйца, молоко.",2018 лето,,,,
Нерех,Татарский,Татарское,МЯСНоЙ ГОРШоК,"праздник, отмечаемый в первое воскресенье сентября в д. Большое Андрейково Татарского с/с","В Мясной Горшок мясо если, старики говорили, так и назвали. Может, курицу зарубят какую.",2019 лето,,,,
Нерех,Татарский,Татьянино,МЯСНоЙ ГОРШоК,праздник 27 августа в д. Андрейково Татарского с/с,"МяснОй горшОк где-то там праздновали, я слыхивала, но не знаю.",2019 лето,,,,
Нерех,Татарский,Татарское,МЯСНоЙ ГОРШоК,праздник в деревне Андрейково Татарского с/с,"В МяснОй ГоршОк резали овец, родные все приходили.",2019 лето,,,,
Нерех,Татарский,Татарское,МЯСНоЙ ГОРШоК,"праздник, отмечавшийся в д. Большое Андрейково Татарского с/с, отмечаемый в конце августа или начале сентября","В Мясной Горшок на гармони играли, плясали под неё.",2019 лето,,,,
Нерех,Татарский,Татьянино,МЯСНоЙ ГОРШоК,праздник 27 августа в д. Андрейково Татарского с/с,"МяснОй горшОк праздновали, а чего делали ‒ не знаю.",2019 лето,,,,
Нерех,Татарский,Ушаково,МЯСНоЙ ГОРШоК,"праздник в деревнях Дьяково и Андрейково Татарского с/с, выпадающий на начало сентября","МяснОй ГоршОк у нас в Андрейково проходит и в Дьяково, два дня, когда мясо поспеет; на Троицу еще молодые барашки, а на МяснОй ГоршОк они уже взрослые",2019 лето,,,,
Нерех,Татарский,Большое Андрейково,МЯСНоЙ ГОРШоК,праздник в деревне Андрейково Татарского с/с,"МяснОй горшОк, это когда все уберут, дескать, все собрали, и самого наверно был.",2019 лето,,,,
Пав,Медведицкий,Медведица,МЯСОеД,воскресенье перед Масленой неделей,"ЯИчное ЗАговенье весной, Яблочное ‒ 22 августа. Было МяснОе ЗАговенье ‒ МясоЕд.",2009 авг.,МЯСНоЕ ЗаГОВЕНЬЕ,,,
Парф,Матвеевский,Матвеево,НЕДоСЕВ ДеНЬ,"праздник, отмечаемый в с. Матвеево Матвеевского с/с в январе",,2006 авг.,,,,
Парф,Савинский,Савино,НЕДоСЕВ ДеНЬ,праздник в д. Завражье Савинского с/с,,2006 авг.,,,,
Парф,Матвеевский,Матвеево,НЕФеДЕВ ДеНЬ,престольный праздник в д. Городище Матвеевского с/с (3 июля),,2006 авг.,,,,
Мак,Юровский,Большие Рымы,НИКоЛА,19 декабря,"Морозы были: никольские морозы ‒ в Николу, сретенские морозы ‒ на Сретенье, а был Афанасий-Ломонос.",2023 лето,,,,
Шар,Шангский,Николо-Шанга,НИКоЛА,день св. Николая Угодника,"В ТАлице НикОла была. НикОлы две ‒ в мае и декабре. Зимняя-то НикОла ‒ 19 декабря, а в мае ‒ не помню.""",2013 лето,,,,
Шар,Шангский,Николо-Шанга,НИКоЛА,Праздник 22 мая,"В Талице был НикОла ‒ двадцать второго мая. // Раньше у нас в НикОлу эту яИца катали. Ставили и катали. Которое яйцо заденут, то и возьмут.",2013 лето,,,,
Мак,Усть-Нейский,Старово,НИКоЛА,"22 мая, праздник в д. Власово Усть-Нейского с/с","Казанская в Юркине 21 июля, Тихон в Белошеине 9 июля, Никола на Власове 22 мая, а у нас Владимирская 6 июля.",2022 лето,,,,
Мак,Вознесенский,Сокорново,НИКоЛА,день св. Николая Чудотворца (зд: 22 мая),"Надо лук посадить до НикОлы, до двадцать второго мая.",2022 лето,,,,
Буй,Шушкодомский,Шушкодом,НИКоЛА,день почитания Николая Чудотворца,"НикОла была праздник, КазАнская, ПарасковИя, ПокрОв, АфанАсьев дЕнь, УленИя. УленИя – это в Тертино праздник 4 июля али июня.",2018 лето,,,,
Мак,Юровский,Большие Рымы,НИКоЛА,22 мая,До Николы лук посадят.,2023 лето,,,,
Буй,Дьяконовский,Печенга,НИКоЛА,"праздник, отмечаемый 22 мая","Есть НикОла ЗИмняя и НикОла ВЁшная. Вот правило до сих пор сохраняется: картошку сажали или неделя до Николы, или неделя после Николы. Должно девяносто-сто дней пройти. А выкапывали после ЗдвИженья.",2018 лето,НИКоЛА ВеШНАЯ,,,
Кадый,Екатеринкинский,Николаевский Починок,НИКоЛА,праздник в б. д. Николаевское [по АТД – Николаевский Починок] (19 декабря),,2004 авг.,,,,
Парф,Задоринский,Николо-Полома,НИКоЛА,праздник 19 декабря в с. Николо-Полома Задоринского с/с,"А 19 декабрЯ, на НикОлу, все в село и приходили.",2006 авг.,,,,
Буй,Воскресенский,Угольское,НИКоЛА,"весенний и зимний церковный праздник, отмечающийся 22 мая и 19 декабря соответственно в д. Угольское Воскресенского с/с",Частушки пели по праздникам. Вот у нас зимняя НикОла и летняя НикОла была ‒ к нам с деревень сходилися.,2018 лето,,,,
Мак,Нижне-Нейский,Селезнево,НИКоЛА,22 мая,В Николу лук сажать начинали.,2022 лето,,,,
Мак,Усть-Нейский,Власово,НИКоЛА,престольный праздник в д. Власово Усть-Нейского с/с (22 мая),,2022 лето,,,,
С-Слав,Залужский,Княжево,НИКоЛА,"праздник д. Княжево Залужского с/с, отмечался 22 мая",Праздновали НикОлу 22 мая. Это был наш годовой праздник.,2019 лето,,,,
Мак,Нижне-Нейский,Селезнево,НИКоЛА,22 мая,На Николу лук сажать надо.,2022 лето,,,,
Буй,Боровский,Борок,НИКоЛА,престольный праздник 19 января в с. Борок Боровского с/с,У нас уж в Борке НикОла ‒ престольный праздник.,2018 лето,,,,
Вохом,Петрецовский,Никола,НИКоЛА,"22 мая, праздник в с. Никола Петрецовского с/с",У нас в НикОле были праздники ‒ ПервомАй и НикОла.,2012 лето,,,,
С-Гал,Первомайский,Оглоблино,НИКоЛА,"праздник, день Николая Чудотворца",НикОла у нас в мае бывает.,2003 июль,,,,
Мак,Николо-Макаровский,Сокольское,НИКоЛА,"праздник, отмечаемый 19 декабря в дд. Александрово, Трещаткино, Сокольское Николо-Макаровского с/с","Отмечались НикОлы в Александрово, Трещаткино, Сокольском у нас еще.",2022 лето,,,,
Буй,Дьяконовский,Дьяконово,НИКоЛА,"день Святого Николая, 22 мая",В саму Николу мы отсАживалися.,2018 лето,До этого дня нужно было закончить посадки.,,,
Мак,Тимошинский,Карьково,НИКоЛА,праздник в дд. Кукуй (Первый и Второй) Тимошинского с/с,"В Кукуе ‒ НикОла, 22 мая.",2022 лето,,,,
Пыщ,Верхнеспасский,Верхне-Спасское,НИКоЛА,"праздник, 19 декабря",НикОла была 19 декабря.,2015 лето,,,,
Буй,Шушкодомский,Шушкодом,НИКоЛА,22 мая,"Картошку в мае, числа с 9‒10 сажают, а на НикОлу уж всегда отсАживаются. А мы раньше НикОлы отсАживались.",2018 лето,,,,
Мак,Нежитинский,Фролово,НИКоЛА,"день св. Николая, 22 мая","ЕгОрий с теплом, а НикОла с копной.",2004 авг.,,,,
Ней,Тотомицкий,Тотомица,НИКоЛА,"праздник 22 мая в дд. Потрусово, Каплино, Макарово Тотомицкого с/с",,2006 авг.,,,,
Ней,Тотомицкий,Тотомица,НИКоЛА,"праздник, отмечаемый в д. Каплино Тотомицкого с/с весной 22.05. и зимой 19.12.","22 мая была НикОла, соберутся, да и гуляли, черёмухи расцветут, как раз на НикОлу ‒ всё было белым-бело.",2006 авг.,,,,
Вохом,Вохомский,Вохма,НИКоЛА,"праздник 22 мая, Николин день","А начинали пасти с НикОлина дня. НикОла пришёл, земельку травке принёс. Вот уже с НикОлина дня тогда уже на пастбище водили.",2011 февраль,,,,
Нерех,Татарский,Татарское,НИКоЛА,"праздник, отмечаемый 19 декабря в д. Моклоково Татарского с/с",Никола ‒ зимний праздник в Моклокове.,2019 лето,,,,
Нерех,Тетеринский,Тетеринское,НИКоЛА,"22 декабря, 22 мая",Зимняя и Летняя Никола у всех была.,2019 лето,,,,
Пыщ,Пыщугский,Пыщуг,НИКоЛА,"праздник 22 мая, отмечаемый в с. Пыщуг Пыщугского с/с",,2015 лето,,,,
К-С,Сидоровский,Булдачиха,НИКоЛА,"праздник, отмечаемый 22 мая и 19 декабря","Николу у нас два раза отмечают, весной ‒ двадцать второго мая, зимой ‒ девятнадцатого декабря.",2019 лето,,,,
Мак,Усть-Нейский,Якимово,НИКоЛА,"21 мая, престольный праздник в д. Власово Усть-Нейского с/с",Во Власове НикОлу праздновали,2022 лето,,,,
Мак,Тимошинский,Карьково,НИКоЛА,22 мая,"Капусту сажают за три дня до Троицы, лук сажают до НикОлы (22 мая).",2022 лето,,,,
Ост,Хомутовский,Якуниха,НИКоЛА,22 мая. Праздник в д. Якуниха Хомутовского с/с,НикОла у нас в ЯкУнихе ‒ годовой праздник,2022 лето,,,,
Вохом,Заветлужский,Плешково,НИКоЛА,Николин день,"В КорЕлах (д.) гуляли между НикОлой и ТрОицей, в КорЕлах не в престольный праздник, простое было воскресение в КорЕлах.",2012 лето,,,,
Мак,Унженский,Унжа,НИКоЛА,22 мая,До Нико’лы лук не садили.,2021 ноябрь,,,,
Шар,Троицкий,Троицкое,НИКоЛА,"день св. Николая, 22 мая",Прошла НикОла ‒ едь с картошкой в поле. Земля должна быть уже готовая.,2012 лето,,,,
Мак,Унженский,Унжа,НИКоЛА,19 декабря,,2021 ноябрь,,,,
Ост,Островский,Островское,НИКоЛА,"престольный праздник в д. Максаково Островского с/с, 22 мая","У нас был праздник Никола, 22 мая. На этот праздник мама готовила сыр из творогА.",2022 лето,,,,
Буй,Шушкодомский,Шушкодом,НИКоЛА,"праздник Никольев день, отмечаемый 14 декабря","Если Михайло закуЁт, то Никола раскуЁт. И наоборот: если Михайло раскуёт, то Никола закуЁт.",2018 лето,,,,
Шар,Конёвский,Кокуй,НИКоЛА,19 декабря в д. Кокуй Конёвского с/с,"НикОла в Кокуе, НикОла 19 декабря.",2012 лето,,,,
Парф,Парфеньевский,Кукушкино,НИКоЛА,"праздник, отмечаемый в д. Кукушкино Парфеньевского с/с 22.05. и 19.12.",НикОла весення бывает и зимня.,2006 авг.,,,,
Нерех,Федоровский,Холомеево,НИКоЛА,"22 мая, праздник в д. Холомеево Федоровского с/с","В нашей деревне, в Холомееве, Николу Летнюю отмечали и Фролов день, Фролы и Лавры. На Николу в пруде купались. Хоть холодно, хоть ты в кустюме, ‒ искупают тебя в пруду.",2019 лето,,,,
Парф,Николо-Поломский,Николо-Полома,НИКоЛА,праздник 19 декабря в пос. Николо-Полома Николо-Поломского с/с,"НикОла зИмняя. НикОлу отгулЯют, там РождествО.",2006 авг.,,,,
Нерех,Емсненский,Мелехово,НИКоЛА,Праздник 19 декабря в д. Мелехово Емсненского с/с,,2019 лето,,,,
Шар,Шангский,Осипово,НИКоЛА,"Праздник, 19 декабря и 22 мая","НикОлу ‒ девятнадцатого декабря и двадцать второго ‒ летнюю, веснЁнную.",2013 лето,,,,
Нерех,Федоровский,Отертиково,НИКоЛА,"престольный праздник в д. Отертиково Федоровского с/с, 22 мая","У нас в ОтЕртикове была НикОла, ФролОв дЕнь.",2019 лето,,,,
Парф,Николо-Поломский,Екимово,НИКоЛА,"праздник 19 декабря, Николай Угодник","НикОлу справляют у нас 19 декабря, раньше в каждой деревне НикОлу справляли. Бывает и летняя НикОла, но мы зимнюю празднуем.",2006 авг.,,,,
Парф,Ширский,Новосёлово,НИКоЛА,"праздник ‒ день св. Николая Угодника, отмечаемый в д. Голошубово Ширского с/с 22 мая и 19 декабря","НикОлу справляли 19 декабря, то ЗИмняя была НикОла.",2006 авг.,,,,
Пав,Петропавловский,Шумково,НИКоЛА,день св. Николая 22 мая,"ЕгОрий несЁт в обОре, а НикОла ‒ с травОй.",2009 авг.,"[т.е. в Егорьев день коровы едят еще не траву, а сено]",,,
С-Слав,Залужский,Ощурки,НИКоЛА,"праздник в д. Ошурки Залужского с/с, 22 мая","Лук сажали на Николу, 22 мая. Или капусту сеют на рассаду в Егорьев день, это 6 мая. Кукушка начинает куковать. И капусту засеваем на рассаду.",2019 лето,,,,
Ост,Клеванцовский,Воскресенское,НИКоЛА,"праздник, отмечаемый 22 мая в б. д. Волчье Клеванцовского с/с","В ВОлчье НикОлу отмечали, НикОлин дЕнь … Есть ЛЕтняя НикОла, есть ЗИмняя НикОла, у нас только ЛЕтняя НикОла.",2023 лето,"НИКоЛИН ДеНЬ, ЛеТНЯЯ НИКоЛА",,,
С-Слав,Расловский,Климцево,НИКоЛА,"праздник, отмечаемый 22 мая","ИльИн дЕнь ‒ НикОльщина, КазАнская, ЗАговенье, НикОла [летний] ‒ тоже НикОльщина <...> До колхозов ещё считалось, что картошку нужно садить до НикОлы, до двадцать второго мая.",2019 лето,,,,
С-Гал,Бурдуковский,Верково,НИКоЛА,"престольный праздник, отмечавшийся в дд. Верховского прихода 19 декабря (Бурдуковский с/с)",,2003 июль,,,,
Нерех,Хомутовский,Хомутово,НИКоЛА,"праздник, отмечаемый 22 мая в Хомутове Хомутовского с/с",Никола был годовой праздник в Хомутове был.,2019 лето,,,,
Кологр,Илешевский,Красный Бор,НИКоЛА,23 апреля,"НикОла с водой, ЕгОрий с травой. Если на НикОлу ВесЕннего снег тает, то ЕгОрия будут встречать с травой.",2024 лето,НИКоЛА ВЕСеННИЙ,,,
Кологр,Ильинский,Ильинское,НИКоЛА,"праздник в с. Ильинское Ильинского с/с, 22 мая",На Николу сажали картофель и все корнеплоды.,2024 лето,,,,
Кологр,Илешевский,Щербетниково,НИКоЛА,19 декабря,"НикОльские морОзы крепкие бывают, когда НикОла. НикОла-то 19 декабря, наверное, бывает.",2024 лето,,,,
Кологр,Илешевский,Красный Бор,НИКоЛА,22 мая,"ЕгОрий с водой, а НикОла с травой.",2024 лето,< б. д. Лаврентьевское (Чухлом. р-н),,,
Кологр,Илешевский,Варзенга,НИКоЛА,"день святителя Николая, праздник, отмечаемый в д. Хапово Илешевского с/с, приходящийся на 19 декабря",В Хапово НикОлу празднуют.,2024 лето,,,,
