District,SS,Toponym,Chrononym,Def,Context,Year,Comment,Latitude,Longitude,DISS
Чухл,Петровский,Асташово,АБРаМЬЕВ ДеНЬ,"праздник, отмечаемый в д. Асташово и б. д. Малое Коровье 1 августа",В честь какого-то батюшки Абрама.,2024 лето,,,,
Пав,Крутогорский,Шайменский,АВДОКеЯ,"день св. Евдокии, 14 марта",,2009 авг.,,,,
Пав,Крутогорский,Шайменский,АВДОКеЯ,14 марта,"Если в АвдокЕю кАплет с потОка, то веснА бУдет хорОшая.",2009 авг.,,,,
Пав,Леденгский,Вторая Леденгская,АВДоТЬЯ-КАПуСТНИЦА,"день, когда сеяли капусту (до Егорьева Дня)","КапУсту сЕяли на АвдОтью-КапУстницу ‒ до ЕгОрьева Дня, до шестОго мАя.",2009 авг.,,,,
Нерех,Татарский,Блазново,АВДоТЬЯ-МАЛиНОВКА,"день в начале августа, когда в лесу поспевает малина","Авдотья-малиновка после Ильина дня когда-то, шли за малиной.",2019 лето,,,,
Чухл,Петровский,Асташово,АВРАаМИЙ,"праздник, отмечаемый 1 августа в д. Асташово",,2024 лето,,,,
Парф,Матвеевский,Матвеево,АДаРЬЯ ‒ НАСЕРи В ПРоРУБЬ,"праздник, отмечаемый в марте","АдАрья ‒ насерИ в прОрубь. ПоИли лошадЕй у прОрубей. А лОшадь испражнЯется, и всё Это течЁт в прОрубь.",2006 авг.,,,,
Ост,Юрьевский,Кияново,АЛЕКСаНДРОВ ДеНЬ,"праздник, отмечаемый в сентябре в б. д. Кияново",,2023 лето,,,,
Вохом,Вохомский,Вохма,АЛЕКСеЕВ ДеНЬ,31 марта ,"На АлексЕев день базАр в ВОхме, такОй был сИльный.",2012 лето,,,,
Вохом,Заветлужский,Юдино,АЛЕКСеЕВ ДеНЬ,31 марта,В АлексЕев День петух напьётся. // Это базарный день.,2012 лето,,,,
Вохом,Лапшинский,Покров,АЛЕКСеЕВ ДеНЬ,"праздник, отмечаемый 30 марта",Между Алексеевым Днем и Благовещеньем снег идет ‒ грибов будет много.,2011 авг.,,,,
Вохом,Сосновский,Хмелевка,АЛЕКСеЕВСКАЯ,православный праздник 30 марта,"""Крешшение, потом БлаговЕщенье, Паска. // Раньше в Михайлов день ярмарка была, в Алексеевскую, в Благовешшенье и в этот, Вознесеньев день ‒ вот в эти дни ярмарки были.""",2012 лето,,,,
Окт,Луптюгский,Афонино,АЛЕКСеЕВСКАЯ,день 29 марта,"РожествО, Васильев вечер, Крещенье, БлаговЕщенье, АлексЕевская, Паска, Троица ‒ это всё большие праздники.",2011 авг.,,,,
Вохом,Петрецовский,Никола,АЛЕКСеЕВСКАЯ,30 марта,"На АлексЕевскую Ярмарка, со всегО райОна собирАлись.",2012 лето,,,,
Вохом,Вохомский,Вохма,АЛЕКСеЕВСКАЯ,"православный праздник, отмечаемый 30 марта","АлексЕевская тридцатого марта. Каковы ручьи с гор, таковы вешние воды",2011 февраль,< д. Плоская Петрецовского с/с,,,
Вохом,Вохомский,Вохма,АЛЕКСеЕВСКАЯ,30 марта,В АлексЕевскую в ВОхме Ярманка былА.,2011 февраль,,,,
Вохом,Вохомский,Вохма,АЛЕКСеЕВСКАЯ,30 марта,На АлексЕевскую в ВОхму на базАр Ездим.,2009 авг.,,,,
Вохом,Обуховский,Шошино,АЛЕКСеЕВСКАЯ,"православный праздник, отмечаемый 30 апреля","Раньше на АлексЕевскую пекли жАворонки, а на половину говЕнья крестЫ, пели ""ЧивилИ-чивилИ, жаворОнки летЯт...""",2012 лето,,,,
Вохом,Вохомский,Вохма,АЛЕКСеЕВСКАЯ,30 марта по н. ст.,"А тридцатого-то марта Алексеевская, вот да, да, Алексеевская. Праздник в Вохме празднуют.",2011 авг.,,,,
Вохом,Вохомский,Вохма,АЛЕКСеЕВСКАЯ,30 марта,На АлексЕевскую базАр в ВОхме бывАл.,2011 авг.,,,,
Вохом,Вохомский,Вохма,АЛЕКСЕеВСКАЯ яРМАРКА,"праздник, отмечаемый в Вохме 30 марта",АлексЕевская Ярмарка тОже былА в ВОхме тридцАтого мАрта былА. А тридцАтого АлексЕя нарождЕние отмечАют.,2011 февраль,,,,
Пав,Доброумовский,Доброумово,АЛЕКСеЕВСКИЙ ДеНЬ,30 марта по н. ст.,На АлексЕевский День тОже дождь Если ‒ корОвы бУдут доИться.,2009 авг.,,,,
Парф,Матвеевский,Ильинское,АЛЕКСеЙ БоЖИЙ ЧЕЛОВеК,"праздник, отмечаемый в д. Ильинское 30 (31 ?) марта","СОрок сорОк бывАет где-то на АлексЕя БОжья ЧеловЕка, сОрок морОзов ждут.",2006 авг.,,,,
Буй,Шушкодомский,Шушкодом,АЛЕКСеЙ БоЖИЙ ЧЕЛОВеК,30 апреля,30 апреля АлексЕя БОжия человЕка когда ‒ жаворОнков пекли.,2018 лето,,,,
Кологр,Суховерховский,Починок,АЛЕКСеЙ ТёПЛОЙ,30 марта,"Мой папа 7 марта родился, а назвали Алексеем, по Алексею Тёплому.",2024 лето,,,,
Буй,Дьяконовский,Вятка,АЛЕКСеЙ ЧЕЛОВеК БоЖИЙ,"праздник, отмечаемый 30 марта","ЖАворонки в Пост пекли, праздник назывался АлексЕй человЕк бОжий.",2018 лето,,,,
Нерех,Федоровский,Федоровское,АЛёНИН ДеНЬ,"праздник, отмечаемый 4 мая",На Алёнин день огурцы сажали.,2019 лето,,,,
Шар,Одоевский,Завражье,АЛёНУШКА,"престольный праздник в б. дд. Завражье, Яковищево, Якутино, Вахнево, отмечавшийся 3 июня","Раньше садИли на АлЁнушку картОшку, а тепЕрь в мАе сАдят.",2012 лето,"АЛёНУШКИ, АЛёНЫ-ГОЛОДёНЫ",,,
Шар,Конёвский,Боярка,АЛёНУШКИ,"день святой Елены, отмечавшийся в д. Боярка 2 августа",АлЁнушки прАздновали два-три дня в БоЯрке. ВторОго Августа онИ бЫли.,2012 лето,,,,
Шар,Конёвский,Подолиха,АЛёНУШКИ,3 июня,"АлЁнушки третьего иЮня, сАдят после них.",2012 лето,,,,
Шар,Конёвский,Бердиха,АЛёНУШКИ,3 июня,В АлЁнушки-те лён сИют.,2012 лето,,,,
Шар,Одоевский,Яковищево,АЛёНУШКИ,"престольный праздник в б. д. Завражье, Яковищево, Якутино, Вахнево, отмечавшийся 3 июня","Вот это были АлЁнушки ‒ престОльный прАздник. Ох, скоро пойдЁм на АлЁны-ГолодЁны. Самый голОдный прАздник.",2012 лето,"АЛёНЫ-ГОЛОДёНЫ, АЛёНУШКА",,,
Шар,Конёвский,Подолиха,АЛёНУШКИ,"день св. Елены, 3 июня",ТеплО после АлЁнушек бывАет.,2012 лето,,,,
Шар,Одоевский,Якутино,АЛёНУШКИ,"день Святой Елены, престольный праздник, отмечаемый 2-3 июня в б. дд. Вахнево, Завражье, Яковищево","В трёх деревнЯх прАздновали АлЁнушки трЕтьего иЮня: в ВАхнево, ЗаврАжье и ЯковИщево.",2012 лето,,,,
Шар,Одоевский,Якутино,АЛёНУШКИ,"престольный праздник, день святой Елены, отмечавшийся в б. дд. Вахнево, Завражье, Яковищево","АлЁнушки тОже бЫли, их в ВАхнево, ЗаврАжье и ЯковИщево прАздновали трЕтьего иЮня.",2012 лето,,,,
Шар,Одоевский,Одоевское,АЛёНУШКИ,"престольный праздник, отмечаемый в б. дд. Яковищево, Завражье, Вахнево 2-3 июня; день Святой Елены","Вроде вторОго иЮня или трЕтьего мы гулЯли, сначАла в ЯковИщево, потОм в ЗаврАжье ходИли и в ВАхнево шли.",2012 лето,АЛёНЫ-ГОЛОДёНЫ,,,
Шар,Конёвский,Подолиха,АЛёНУШКИ,"день св. Елены, 3 июня",ТеплО после АлЁнушек бывАет.,2012 лето,,,,
Шар,Одоевский,Одоевское,АЛёНЫ,"престольный праздник в б. д. Яковищево, 3 июня","АлЁны в ОдОевском, в ЯковИщеве, трЕтьего иЮня.",2012 лето,,,,
Шар,Одоевский,Вахнево,АЛёНЫ-ГОЛОДёНЫ,"престольный праздник в б. дд. Завражье, Яковищево, Якутино, Вахнево, отмечавшийся 3 июня","Вот это были АлЁнушки ‒ престОльный прАздник. Ох, скоро пойдЁм на АлЁны-ГолодЁны. Самый голОдный прАздник. Ничего не вЫросло, запАсы через зИму кОнчились.",2012 лето,"АЛёНУШКА, АЛёНУШКИ",,,
Шар,Одоевский,Одоевское,АЛёНЫ-ГОЛОДёНЫ,"день Святой Елены, отмечаемый 2-3 июня","На АлЁны-ГолодЁны ходИли пАрами по селУ, пели; это и есть АлЁнушки-то.",2012 лето,АЛёНУШКИ,,,
Вохом,Семёновский,Спас,АНДРоПЫ-РАСТОРоПЫ,"праздник, отмечаемый 16 марта",АндрОпы-РасторОпы: если тает ‒ ранняя весна будет.,2011 авг.,,,,
Мак,Красногорский,Домань,АНиСЬЯ-ПОЛУЗиМНИЦА,6 февраля,"29-го января – Петр-Полукорм, 6 февраля – Анисья-Полузимница, Анисья-Полухлебница. Половина запасов съедена.",2022 лето,,,,
Мак,Красногорский,Домань,АНиСЬЯ-ПОЛУХЛеБНИЦА,6 февраля,"29-го января – Петр-Полукорм, 6 февраля – Анисья-Полузимница, Анисья-Полухлебница. Половина запасов съедена.",2022 лето,,,,
Мак,Красногорский,Домань,аННА,"7 августа, именины имени Анна","Макрида снаряжает осень, а Анна зиму. В этот день смотрят: если листочки будут падать медленно, то зима будет долгая и суровая. А что за Анна такая? Дак это именины у Анны в этот день.",2024 лето,,,,
Мак,Красногорский,Домань,аННА-ХОЛоДНИЦА,"7 августа, день успения праведной Анны",,2023 лето,,,,
Мак,Юровский,Большие Рымы,аННЫ НИКоЛЬСКИЕ,22 декабря,"Анны Никольские были: молились бабы о ребёночке, кто родить хотел.",2023 лето,,,,
Буй,Шушкодомский,Шушкодом,аННЫ ПРОРоЧИЦЫ,22 декабря,Анны ‒ они в декабре. Анны ПрорОчицы будут 22 декабря.,2018 лето,аННЫ,,,
Мак,Шемятинский,Шемятино,АНоФРЕВ ДеНЬ,"праздник в д. Шемятино и Филисово, отмечаемый 25 июня",,2021 ноябрь,,,,
Парф,Крусановский,Ямище,АНоФРИЕВ ДеНЬ,престольный праздник б. д. Ямище (25 июня),"В БрАгине ТИфинская былА, у нас ‒ РизоположЕние, а в Ямище ‒ АнОфриев День.",2006 авг.,,,,
Пав,Петропавловский,Доровица,АНТРоПА-РАСТОРоПА,17 марта,На АнтрОпа-РасторОпа снег ‒ бУдут грибЫ.,2009 авг.,,,,
Пав,Петропавловский,Первая Грязучая,АНТРоПЫ-РАСТОРоПЫ,день в марте (какой?),АнтрОпы-РасторОпы... коудЫ уже снег тАет.,2009 авг.,,,,
Мак,Шемятинский,Гребенец,АНуФРИЕВ ДеНЬ,"25 июня, престольный праздник в д. Гребенец",В Гребенце был такой праздник ‒ АнУфриев день,2022 лето,,,,
Мак,Шемятинский,Шемятино,АНуФРИЕВ ДеНЬ,"праздник 25 июня, приурочен к началу сенокоса","Сенокос начинали в конце июня с АнУфриева дня. 25 июня обычно начинали сенокос. Дак тут не праздновали, в Шемятине праздновали.",2021 ноябрь,,,,
Нерех,Лавровский,Иголкино,АНФИНОГеНОВ ДеНЬ,"один из годичных праздников, который отмечают 29 июля в д. Иголкино",Каждый год 29 июля на АнфиногЕнов дЕнь в нашей деревне устраивают гуляния.,2019 лето,,,,
Кологр,Илешевский,Варзенга,АРиНА РАССаДНИЦА,"день 5 мая, когда садили рассаду","А 5 мая АрИна РассАдница, в этот день всё сажают.",2024 лето,,,,
Ост,Заборский,Александровское,АРиНА РАССаДНИЦА,"3 июня ‒ день в народном календаре, по которому определяли сроки рассады",До АрИны РассАдницы надо огурцы посадить.,2024 лето,,,,
Кологр,Суховерховский,Починок,АРиНА РАССаДНИЦА,день в мае (какой?),"В Арину Рассадницу плевали капусту. Рассадник был такой, как кроватка. На солнечной стороне он. Мамка возьмёт семян в рот, плюёт, закроет кошулей или другой какой оболочкой.",2024 лето,,,,
Меж,Петушихский,Барановица,АРиНА РАССаДНИЦА,день в конце мая,"Арина Рассадница была, высаживали рассаду.",2024 лето,,,,
Мак,Красногорский,Домань,АФАНаСИЙ-ЛОМОНоС,31 января,"Афанасий-ломонос, Афанасьевские морозы. Серьезные морозы.",2022 лето,,,,
Мак,Юровский,Большие Рымы,АФАНаСИЙ-ЛОМОНоС,день в конце января,"Морозы были: никольские морозы -- в Николу, сретенские морозы -- на Сретенье, а был Афанасий-Ломонос.",2023 лето,,,,
С-Слав,Воронский,Завражье,АФАНаСЬЕВ ДеНЬ,праздник в д. Завражье,"здесь праздник ‒ АфанАсьев день ‒ 31 января, это в нашей деревне",2019 лето,,,,
С-Слав,Воронский,Митюшино,АФАНаСЬЕВ ДеНЬ,престольный праздник в д. Митюшино (31 января),,2019 лето,,,,
С-Слав,Воронский,Митюшино,АФАНаСЬЕВ ДеНЬ,"праздник, справляемый в д. Митюшино 31 января",,2019 лето,,,,
Буй,Шушкодомский,Шушкодом,АФАНаСЬЕВ ДеНЬ,"праздник, отмечаемый в д. Гусево 18 июля",,2018 лето,,,,
Буй,Шушкодомский,Шушкодом,АФАНаСЬЕВ ДеНЬ,день почитания святого Афанасия,"НикОла была праздник, КазАнская, ПарасковИя, ПокрОв, АфанАсьев дЕнь, УленИя. УленИя – это в Тертино праздник 4 июля али июня.",2018 лето,,,,
С-Слав,Воронский,Митюшино,АФАНаСЬЕВ ДеНЬ,престольный праздник д. Митюшино (31 января),Вот в Митюшине Афанасьев день ‒ их праздник.,2019 лето,,,,
Нерех,Лавровский,Иголкино,АФИНОГеНОВ ДеНЬ,28 июля,"Афиногенов день был в Иголкине, святой Афиноген был.",2019 лето,,,,
Буй,Шушкодомский,Шушкодом,АФОНаСЬЕВ ДеНЬ,"праздник в д. Гусево, 22 июня",,2018 лето,,,,
Буй,Шушкодомский,Заломаево,АФОНаСЬЕВ ДЕНЬ,"престольный праздник д. Заломаево, 29 июня","В каждой деревне был свой праздник. У нас, в Овсянниково, был ТИхонов дЕнь, 29 июня. Отмечали два дня. А 18 июля в Заломаеве АфонАсьев день.",2018 лето,,,,
Мак,Юровский,Большие Рымы,БаБИЙ ДеНЬ,21 сентября,"Бабий день большой праздник, Богородицын день ешшо звали. Богородице молились бабы в моленных домах. В Рожество молились, в Паску, в Бабий день.",2023 лето,,,,
Окт,Покровский,Катушенки,БаБИЙ ДеНЬ,день в середине сентября (14 сентября?),"СмотрЕли, чтобы не слезомОйка пЕрвая вЫшла на Улицу. Если в БАбий день слезомОйка вЫйдет ‒ дождь бУдет, пока картОшку копАем.",2011 февраль,,,,
Мак,Усть-Нейский,Манылово,БаБИЙ ПРаЗДНИК,27 сентября,"Звиженье звали Бабий праздник. Всё сжали, всё убрали, остался только лён.",2022 лето,,,,
К-С,Сидоровский,Светочева Гора,БаБИЙ ПРаЗДНИК,четверг перед Троицей,"Перед Троицей был Семик, звали ешшо Бабий праздник. Берёзку нарядят лоскутками. Поставят берёзку на бою, на бойкое место.",2019 лето,,,,
Окт,Стариковский,Ильинское,БаБЬЕ ЛеТО,период с 14 сентября по 21 сентября,БАбье лЕто с четЫрнадцатого сентябрЯ по двАдцать пЕрвое ‒ онО числовОе. ЧетЫрнадцатого сентябрЯ СемЁнов День. В СемЁнов День ужЕ закАнчивается убОрка с пОля. А бАбье лЕто кончАется ужЕ двадцать пЕрвого.,2011 авг.,,,,
Шар,Марутинский,Ракитиха,БаБЬЕ ЛеТО,период с 7 по 14 сентября,"МолодОе бАбье лЕто ‒ с 1 по 7 сентября, а настоЯшше бАбье лЕто ‒ с 7 по 14 сентября.",2014 авг.,,,,
Окт,Покровский,Катушенки,БаБЬЕ ЛеТО,время с 14 сентября,"Если до БАбья ЛЕта дождь, то БАбье ЛЕто вЁдерное станОвится.",2011 февраль,,,,
Шар,Троицкий,Руданиха,БаТЮШКО ПОКРоВ,"Покров Богородицы, 14 октября",,2012 лето,,,,
Мак,Усть-Нейский,Манылово,БаТЮШКО-ПОКРоВ,(фольк.) 14 октября," Батюшко-Покров, подай добрую свекровь!",2022 лето,,,,
Ост,Адищевский,Адищево,БЕРёЗКА,"престольный праздник в с. Адищево; то же, что Троица","Троица была, БерЁзкой называли, потом ПетрОв дЕнь.",2023 лето,Информант не объясняет связь названия с празднованием.,,,
С-Слав,Судиславский,Болотово,БЕРёЗКА,"праздник, отмечаемый в с. Жвалово, в д. Болотово на Троицу","На БерЁзку проводили мероприятие, ленточки завязывали ‒ больше в Болотово / в ЖвАлово веночки кидают: который дальше уплывет, выйдет замуж / это русская ТрОица, после Пасхи двунадесятый праздник. Выбирали красивую берёзку, помощи на урожай, на детей просили, навязывали ленточки, банты. Чтобы узнать судьбу бросали в речку: утонул ‒ не сложится, к берегу прибьет ‒ ничего не изменится, дальше уплывёт ‒ всё хорошо будет.",2019 лето,,,,
Окт,Покровский,Сосновка,БЛАВеЩЕНЬЕ,"Благовещенье, 7 апреля","БлавЕшшенье ‒ великий праздник, не меньше ПАски. Никакую работу не начинают.",2011 авг.,,,,
Пав,Петропавловский,Доровица,БЛАВеЩЕНЬЕ,праздник Благовещенье,"В БлавЕшшеньё пережигАли соль. Штёб скотА не (в)здУло, ёмУ давАли.",2009 авг.,,,,
Шар,Поляшовский,Бухалкино,БЛАВеЩЕНЬЕ,7 апреля,"Если на БлавЕшшенье заморОзит, то бУдет 40 Утренников. Если не заморОзит, то веснА тЁплая.",2014 авг.,,,,
Окт,Стариковский,Огурцы,БЛАВеЩЕНЬЁ,Благовещенье,На БлавЕщеньё теплО ‒ вывЁртывай завЁртки у санЕй. Если хОлодно ‒ в Устюг езжАй.,2011 авг.,,,,
Шар,Поляшовский,Бухалкино,БЛаГОВЕСТ,"Благовещенье, 7 апреля","БлАговест 7 апреля. Дома обходили с иконой. Молитву читали, чтоб пожара не было.",2015 лето,,,,
Вохом,Сосновский,Андрианово,БЛАГОВеЩЕНИЕ,7 апреля,"БлаговЕщение ‒ 7 апреля, птичка гнёздышка не вьёт, девица косу не плетёт, в БлаговЕщение ничего не делали.",2012 лето,,,,
Буй,Куриловский,Лытавино,БЛАГОВеЩЕНИЕ,"праздник, отмечаемый 7 апреля в деревнях Куриловского с/с","В БлаговЕщение смотрели: если морозно, то ещё сорок дней будет мороз, холодная весна.",2018 лето,,,,
Окт,Покровский,Клюкино,БЛАГОВеЩЕНИЕ,7 апреля,На БлаговЕшшение никтО никогдА не рабОтал.,2011 февраль,,,,
Окт,Соловецкий,Макарьевская,БЛАГОВеЩЕНИЕ,7 апреля,"На БлаговЕшшение нельзЯ в огорОде дЕлать. ЗЕмлю не копАй, лук не садИ. НичегО нельзЯ начинАть. СтрОго Это.",2011 февраль,,,,
Шар,Конёвский,Подолиха,БЛАГОВеЩЕНСКАЯ,"Благовещение Богородицы, 7 апреля",После БлаговЕщенской сОрок морОзов бывАет. БлаговЕщенская ‒ она в чИслах.,2012 лето,,,,
